{"name":"Vercel","industry":"developer-platform","emotion":"neutral","brand_personality":["neutral voice","you-only pronoun posture","material-you material"],"color_system":{"primary":"#0068d6","secondary":"#52aeff","accent":"#0070f3","background":"#fafafa"},"typography":{"primary_font":"Geist","heading_style":{"h1":"48px / 600"},"body_style":{"size":"16px"},"mono_font":"Geist Mono"},"layout_language":{"grid":"56 grid / 500 flex","section_style":"landing"},"component_patterns":["buttons","cards","inputs","links","navigation","footer","dropdowns","badges","tabs","tooltips","switches"],"design_patterns":[{"name":"flex-dominant layout with grid support","category":"layout","abstraction":"semantic","confidence":0.92,"evidence_refs":["github://Manavarya09/design-extract/website/public/gallery/vercel-com/vercel-com-DESIGN.md@f23f560b495c00dd8728179fc80c7a43f993e821"]},{"name":"large display type over compact body scale","category":"typography","abstraction":"semantic","confidence":0.92,"evidence_refs":["github://Manavarya09/design-extract/website/public/gallery/vercel-com/vercel-com-DESIGN.md@f23f560b495c00dd8728179fc80c7a43f993e821"]},{"name":"radius scale spans subtle corners to pill controls","category":"shape","abstraction":"semantic","confidence":0.95,"evidence_refs":["github://Manavarya09/design-extract/website/public/gallery/vercel-com/vercel-com-DESIGN.md@f23f560b495c00dd8728179fc80c7a43f993e821"]},{"name":"neutral second-person marketing voice","category":"voice","abstraction":"semantic","confidence":0.95,"evidence_refs":["github://Manavarya09/design-extract/website/public/gallery/vercel-com/vercel-com-DESIGN.md@f23f560b495c00dd8728179fc80c7a43f993e821"]},{"name":"primary sans with utility mono","category":"typography","confidence":0.9,"evidence_refs":["github://Manavarya09/design-extract/website/public/gallery/vercel-com/vercel-com-DESIGN.md@f23f560b495c00dd8728179fc80c7a43f993e821"]}],"provenance":{"source_url":"https://vercel.com","extraction_backend":"designlang","extraction_manifest":"../normalized/extraction-manifest.json","captured_at":"2026-05-21T11:46:57.594Z","source_repo":"Manavarya09/design-extract","source_blob_sha":"f23f560b495c00dd8728179fc80c7a43f993e821","freshness":"historical_snapshot_live_revalidation_pending"},"evidence":[{"claim":"Designlang classified the page voice as neutral and pronoun posture as you-only.","type":"observed","artifact_ref":"github://Manavarya09/design-extract/website/public/gallery/vercel-com/vercel-com-DESIGN.md@f23f560b495c00dd8728179fc80c7a43f993e821","confidence":0.95},{"claim":"Layout uses 56 grid / 500 flex.","type":"observed","artifact_ref":"github://Manavarya09/design-extract/website/public/gallery/vercel-com/vercel-com-DESIGN.md@f23f560b495c00dd8728179fc80c7a43f993e821","confidence":1.0},{"claim":"Body type is 16px and H1 is 48px / 600.","type":"observed","artifact_ref":"github://Manavarya09/design-extract/website/public/gallery/vercel-com/vercel-com-DESIGN.md@f23f560b495c00dd8728179fc80c7a43f993e821","confidence":1.0},{"claim":"Radius values include 2px, 5px, 8px, 16px, 32px, 50px.","type":"observed","artifact_ref":"github://Manavarya09/design-extract/website/public/gallery/vercel-com/vercel-com-DESIGN.md@f23f560b495c00dd8728179fc80c7a43f993e821","confidence":1.0},{"claim":"The page is flex-dominant while retaining meaningful grid usage.","type":"derived","artifact_ref":"github://Manavarya09/design-extract/website/public/gallery/vercel-com/vercel-com-DESIGN.md@f23f560b495c00dd8728179fc80c7a43f993e821","confidence":0.92},{"claim":"The typography uses large display headings over a compact body scale.","type":"derived","artifact_ref":"github://Manavarya09/design-extract/website/public/gallery/vercel-com/vercel-com-DESIGN.md@f23f560b495c00dd8728179fc80c7a43f993e821","confidence":0.92},{"claim":"The radius system spans subtle corners through highly rounded/pill controls.","type":"derived","artifact_ref":"github://Manavarya09/design-extract/website/public/gallery/vercel-com/vercel-com-DESIGN.md@f23f560b495c00dd8728179fc80c7a43f993e821","confidence":0.95},{"claim":"The brand uses a neutral, direct second-person marketing posture.","type":"derived","artifact_ref":"github://Manavarya09/design-extract/website/public/gallery/vercel-com/vercel-com-DESIGN.md@f23f560b495c00dd8728179fc80c7a43f993e821","confidence":0.95},{"claim":"A primary sans family is paired with a utility mono family.","type":"derived","artifact_ref":"github://Manavarya09/design-extract/website/public/gallery/vercel-com/vercel-com-DESIGN.md@f23f560b495c00dd8728179fc80c7a43f993e821","confidence":0.9}],"confidence":0.9}
