{"name":"Linear","industry":"product-development-saas","emotion":"neutral","brand_personality":["neutral voice","you-only pronoun posture","material-you material"],"color_system":{"primary":"#e4f222","secondary":"#5e6ad2","accent":"#00ff05","background":"#08090a"},"typography":{"primary_font":"Inter Variable","heading_style":{"h1":"64px / 510"},"body_style":{"size":"14px"},"mono_font":"Berkeley Mono"},"layout_language":{"grid":"98 grid / 495 flex","section_style":"landing"},"component_patterns":["buttons","cards","inputs","links","navigation","footer","dropdowns","badges","avatars","switches"],"design_patterns":[{"name":"flex-dominant layout with grid support","category":"layout","abstraction":"semantic","confidence":0.92,"evidence_refs":["github://Manavarya09/design-extract/website/public/gallery/linear-app/linear-app-DESIGN.md@9aad83bc32721d5741e2ee3b9e596a1979e7a82f"]},{"name":"large display type over compact body scale","category":"typography","abstraction":"semantic","confidence":0.92,"evidence_refs":["github://Manavarya09/design-extract/website/public/gallery/linear-app/linear-app-DESIGN.md@9aad83bc32721d5741e2ee3b9e596a1979e7a82f"]},{"name":"radius scale spans subtle corners to pill controls","category":"shape","abstraction":"semantic","confidence":0.95,"evidence_refs":["github://Manavarya09/design-extract/website/public/gallery/linear-app/linear-app-DESIGN.md@9aad83bc32721d5741e2ee3b9e596a1979e7a82f"]},{"name":"neutral second-person marketing voice","category":"voice","abstraction":"semantic","confidence":0.95,"evidence_refs":["github://Manavarya09/design-extract/website/public/gallery/linear-app/linear-app-DESIGN.md@9aad83bc32721d5741e2ee3b9e596a1979e7a82f"]},{"name":"primary sans with utility mono","category":"typography","confidence":0.9,"evidence_refs":["github://Manavarya09/design-extract/website/public/gallery/linear-app/linear-app-DESIGN.md@9aad83bc32721d5741e2ee3b9e596a1979e7a82f"]}],"provenance":{"source_url":"https://linear.app","extraction_backend":"designlang","extraction_manifest":"../normalized/extraction-manifest.json","captured_at":"2026-05-21T11:46:56.723Z","source_repo":"Manavarya09/design-extract","source_blob_sha":"9aad83bc32721d5741e2ee3b9e596a1979e7a82f","freshness":"historical_snapshot_live_revalidation_pending"},"evidence":[{"claim":"Designlang classified the page voice as neutral and pronoun posture as you-only.","type":"observed","artifact_ref":"github://Manavarya09/design-extract/website/public/gallery/linear-app/linear-app-DESIGN.md@9aad83bc32721d5741e2ee3b9e596a1979e7a82f","confidence":0.95},{"claim":"Layout uses 98 grid / 495 flex.","type":"observed","artifact_ref":"github://Manavarya09/design-extract/website/public/gallery/linear-app/linear-app-DESIGN.md@9aad83bc32721d5741e2ee3b9e596a1979e7a82f","confidence":1.0},{"claim":"Body type is 14px and H1 is 64px / 510.","type":"observed","artifact_ref":"github://Manavarya09/design-extract/website/public/gallery/linear-app/linear-app-DESIGN.md@9aad83bc32721d5741e2ee3b9e596a1979e7a82f","confidence":1.0},{"claim":"Radius values include 1px, 4px, 7px, 12px, 16px, 20px.","type":"observed","artifact_ref":"github://Manavarya09/design-extract/website/public/gallery/linear-app/linear-app-DESIGN.md@9aad83bc32721d5741e2ee3b9e596a1979e7a82f","confidence":1.0},{"claim":"The page is flex-dominant while retaining meaningful grid usage.","type":"derived","artifact_ref":"github://Manavarya09/design-extract/website/public/gallery/linear-app/linear-app-DESIGN.md@9aad83bc32721d5741e2ee3b9e596a1979e7a82f","confidence":0.92},{"claim":"The typography uses large display headings over a compact body scale.","type":"derived","artifact_ref":"github://Manavarya09/design-extract/website/public/gallery/linear-app/linear-app-DESIGN.md@9aad83bc32721d5741e2ee3b9e596a1979e7a82f","confidence":0.92},{"claim":"The radius system spans subtle corners through highly rounded/pill controls.","type":"derived","artifact_ref":"github://Manavarya09/design-extract/website/public/gallery/linear-app/linear-app-DESIGN.md@9aad83bc32721d5741e2ee3b9e596a1979e7a82f","confidence":0.95},{"claim":"The brand uses a neutral, direct second-person marketing posture.","type":"derived","artifact_ref":"github://Manavarya09/design-extract/website/public/gallery/linear-app/linear-app-DESIGN.md@9aad83bc32721d5741e2ee3b9e596a1979e7a82f","confidence":0.95},{"claim":"A primary sans family is paired with a utility mono family.","type":"derived","artifact_ref":"github://Manavarya09/design-extract/website/public/gallery/linear-app/linear-app-DESIGN.md@9aad83bc32721d5741e2ee3b9e596a1979e7a82f","confidence":0.9}],"confidence":0.9}
