{"name":"Stripe","industry":"fintech","emotion":"neutral","brand_personality":["neutral voice","you-only pronoun posture","flat material"],"color_system":{"primary":"#533afd","secondary":"#e5edf5","accent":"#ffe0d1","background":"#ffffff"},"typography":{"primary_font":"sohne-var","heading_style":{"h1":"56px / 300"},"body_style":{"size":"16px"}},"layout_language":{"grid":"53 grid / 374 flex","section_style":"landing"},"component_patterns":["buttons","cards","links","navigation","footer","modals","dropdowns","badges","progressBars","switches"],"design_patterns":[{"name":"flex-dominant layout with grid support","category":"layout","abstraction":"semantic","confidence":0.92,"evidence_refs":["github://Manavarya09/design-extract/website/public/gallery/stripe-com/stripe-com-DESIGN.md@cfee6055909b6bd84c1b9fae4ff20dc4dd0d74bf"]},{"name":"large display type over compact body scale","category":"typography","abstraction":"semantic","confidence":0.92,"evidence_refs":["github://Manavarya09/design-extract/website/public/gallery/stripe-com/stripe-com-DESIGN.md@cfee6055909b6bd84c1b9fae4ff20dc4dd0d74bf"]},{"name":"radius scale spans subtle corners to pill controls","category":"shape","abstraction":"semantic","confidence":0.95,"evidence_refs":["github://Manavarya09/design-extract/website/public/gallery/stripe-com/stripe-com-DESIGN.md@cfee6055909b6bd84c1b9fae4ff20dc4dd0d74bf"]},{"name":"neutral second-person marketing voice","category":"voice","abstraction":"semantic","confidence":0.95,"evidence_refs":["github://Manavarya09/design-extract/website/public/gallery/stripe-com/stripe-com-DESIGN.md@cfee6055909b6bd84c1b9fae4ff20dc4dd0d74bf"]}],"provenance":{"source_url":"https://stripe.com","extraction_backend":"designlang","extraction_manifest":"../normalized/extraction-manifest.json","captured_at":"2026-05-21T11:46:59.896Z","source_repo":"Manavarya09/design-extract","source_blob_sha":"cfee6055909b6bd84c1b9fae4ff20dc4dd0d74bf","freshness":"historical_snapshot_live_revalidation_pending"},"evidence":[{"claim":"Designlang classified the page voice as neutral and pronoun posture as you-only.","type":"observed","artifact_ref":"github://Manavarya09/design-extract/website/public/gallery/stripe-com/stripe-com-DESIGN.md@cfee6055909b6bd84c1b9fae4ff20dc4dd0d74bf","confidence":0.95},{"claim":"Layout uses 53 grid / 374 flex.","type":"observed","artifact_ref":"github://Manavarya09/design-extract/website/public/gallery/stripe-com/stripe-com-DESIGN.md@cfee6055909b6bd84c1b9fae4ff20dc4dd0d74bf","confidence":1.0},{"claim":"Body type is 16px and H1 is 56px / 300.","type":"observed","artifact_ref":"github://Manavarya09/design-extract/website/public/gallery/stripe-com/stripe-com-DESIGN.md@cfee6055909b6bd84c1b9fae4ff20dc4dd0d74bf","confidence":1.0},{"claim":"Radius values include 1px, 4px, 8px, 16px, 100px.","type":"observed","artifact_ref":"github://Manavarya09/design-extract/website/public/gallery/stripe-com/stripe-com-DESIGN.md@cfee6055909b6bd84c1b9fae4ff20dc4dd0d74bf","confidence":1.0},{"claim":"The page is flex-dominant while retaining meaningful grid usage.","type":"derived","artifact_ref":"github://Manavarya09/design-extract/website/public/gallery/stripe-com/stripe-com-DESIGN.md@cfee6055909b6bd84c1b9fae4ff20dc4dd0d74bf","confidence":0.92},{"claim":"The typography uses large display headings over a compact body scale.","type":"derived","artifact_ref":"github://Manavarya09/design-extract/website/public/gallery/stripe-com/stripe-com-DESIGN.md@cfee6055909b6bd84c1b9fae4ff20dc4dd0d74bf","confidence":0.92},{"claim":"The radius system spans subtle corners through highly rounded/pill controls.","type":"derived","artifact_ref":"github://Manavarya09/design-extract/website/public/gallery/stripe-com/stripe-com-DESIGN.md@cfee6055909b6bd84c1b9fae4ff20dc4dd0d74bf","confidence":0.95},{"claim":"The brand uses a neutral, direct second-person marketing posture.","type":"derived","artifact_ref":"github://Manavarya09/design-extract/website/public/gallery/stripe-com/stripe-com-DESIGN.md@cfee6055909b6bd84c1b9fae4ff20dc4dd0d74bf","confidence":0.95}],"confidence":0.9}
